participant_uid,title,content
UID001,Assignment 1,West third box then reflect what church.
UID002,Assignment 2,Laugh vote southern body base central.
UID003,Assignment 3,Film use dark attention return turn huge issue.
UID004,Assignment 4,Group firm collection.
UID005,Assignment 5,Television prepare benefit director race huge little.
UID006,Assignment 6,Sister control possible stay business wrong deep.
UID007,Assignment 7,Kid somebody fire capital rather.
UID008,Assignment 8,Bag any explain know cold daughter.
UID009,Assignment 9,After industry win billion subject employee.
UID010,Assignment 10,Message war onto bad owner with.
UID011,Assignment 11,That him chance.
UID012,Assignment 12,Professor at specific change eye resource suggest director.
UID013,Assignment 13,Where charge like.
UID014,Assignment 14,Effect black rule bag vote.
UID015,Assignment 15,Remain level happen tend some get carry.
UID016,Assignment 16,Far hundred whole tend.
UID017,Assignment 17,Toward cost bag trip sing tonight.
UID018,Assignment 18,Over end democratic dinner to.
UID019,Assignment 19,Movie face pick baby hope laugh.
UID020,Assignment 20,Positive cost moment society.
UID021,Assignment 21,Control discussion hope sing process walk subject.
UID022,Assignment 22,Sing strategy purpose need since source issue.
UID023,Assignment 23,Part probably speech.
UID024,Assignment 24,Seek dog wind.
UID025,Assignment 25,Mother among draw institution dream.
UID026,Assignment 26,Employee into fish same answer.
UID027,Assignment 27,Point believe music herself east as let yet.
UID028,Assignment 28,Long admit shoulder home attention.
UID029,Assignment 29,Speak shake writer weight laugh state.
UID030,Assignment 30,Section successful strategy above everybody control energy.
UID031,Assignment 31,End technology value through six front main.
UID032,Assignment 32,Her least stay many general.
UID033,Assignment 33,Identify born ready short risk hundred budget.
UID034,Assignment 34,Better pull cup better watch.
UID035,Assignment 35,Consider become weight professional drop there remain.
UID036,Assignment 36,Room his right doctor.
UID037,Assignment 37,Practice off others on.
UID038,Assignment 38,Next wait reflect accept against data student.
UID039,Assignment 39,Mr sea share red catch.
UID040,Assignment 40,Article sound wish here represent eight day.
UID041,Assignment 41,Treat quality stuff including.
UID042,Assignment 42,Method my carry environmental different.
UID043,Assignment 43,Result position sell home party gas back.
UID044,Assignment 44,Leg same happen buy town me black.
UID045,Assignment 45,Buy wall detail.
UID046,Assignment 46,Never million suggest form him.
UID047,Assignment 47,Senior talk hit think pick follow your place.
UID048,Assignment 48,Dog blue would dinner author wait.
UID049,Assignment 49,Yourself build article them account citizen.
UID050,Assignment 50,Word career really church resource minute south involve.
UID051,Assignment 51,Door Mrs usually.
UID052,Assignment 52,Store nearly along over continue.
UID053,Assignment 53,Factor blood listen.
UID054,Assignment 54,Only staff education cut major today.
UID055,Assignment 55,Put across resource others.
UID056,Assignment 56,Drop should fall majority leg opportunity reduce.
UID057,Assignment 57,Road main bed newspaper again discover thus.
UID058,Assignment 58,Little indeed expert line must soon finish word.
UID059,Assignment 59,Especially high start institution rich prepare.
UID060,Assignment 60,Step dream different whatever discussion region law happy.
UID061,Assignment 61,Cost money factor sea where.
UID062,Assignment 62,Officer grow wish what be land including.
UID063,Assignment 63,Risk able price fact stop simply bank.
UID064,Assignment 64,Science positive nor election image.
UID065,Assignment 65,Music administration benefit draw base huge.
UID066,Assignment 66,Grow center drop yeah ask nearly image.
UID067,Assignment 67,Finally last which commercial subject politics.
UID068,Assignment 68,Cup seven resource future institution sort agency.
UID069,Assignment 69,Before sea brother attorney finally able bed debate.
UID070,Assignment 70,Enjoy stock spend name arrive.
UID071,Assignment 71,Total start statement tough.
UID072,Assignment 72,Crime focus would reduce true do.
UID073,Assignment 73,Positive stop letter various.
UID074,Assignment 74,Those water account hope woman.
UID075,Assignment 75,Budget clearly east real sound.
UID076,Assignment 76,Notice much top child age make.
UID077,Assignment 77,Meeting moment class fine.
UID078,Assignment 78,Go everything garden thousand which of among there.
UID079,Assignment 79,Ground everyone nation agree partner computer reason.
UID080,Assignment 80,Example couple book yeah class media until.
UID081,Assignment 81,Magazine this provide character.
UID082,Assignment 82,Cup small morning major young.
UID083,Assignment 83,Animal dark quite personal point.
UID084,Assignment 84,Friend yard prepare Congress him area.
UID085,Assignment 85,Say name the challenge mean produce city style.
UID086,Assignment 86,South gun federal without interesting hard rest always.
UID087,Assignment 87,Seven see administration you.
UID088,Assignment 88,Point protect television million author.
UID089,Assignment 89,Its particularly present.
UID090,Assignment 90,Sea consider marriage because range.
UID091,Assignment 91,Heavy condition your she eight maybe administration.
UID092,Assignment 92,Perform need firm tough education cultural even.
UID093,Assignment 93,Blue point voice view opportunity exactly go.
UID094,Assignment 94,Community any thought chance far.
UID095,Assignment 95,Health least since nation add usually your.
UID096,Assignment 96,Respond natural open important.
UID097,Assignment 97,Other help so notice plan south.
UID098,Assignment 98,Direction cultural wish instead room manage know.
UID099,Assignment 99,Either civil bed drive position it.
UID100,Assignment 100,Worker people address range.
